id,airport_city,airport_name,airport_id,lounge_name,LoungeID,lounge_timing,directions,important_information,MainSummary,Introduction,airport,LoungeNamePublic,InternationalLounge,TerminalsSelect,Location,LoungeStatus,metaTitle,metaDescription,total_rated_user,min_rated,max_rated,average_rated,total_rating_count,airportimagemap,loungeImages_0_url,loungeImages_1_url,loungeImages_2_url,amenities_id,amenities_field,amenities_order,amenities_component_type,amenities_component_id,amenities_lounge_detail_id,amenities_Food,amenities_DisabledAccess,amenities_TV,amenities_Internet,amenities_NoSmoking,amenities_SmokingArea,amenities_AlcoholicDrinks,amenities_NewspapersMagazines,amenities_WiFi,amenities_AirConditioning,amenities_Television,amenities_Shower,amenities_Spa,amenities_Printer
117,Kolkata,Netaji Subhas Chandra Bose International Airport,CCU,Kolkata Travel Club lounge International T2,,24 hours,"After passing through Security Checks, the lounge is on the Mezzanine Level, Airside. You'll find it on the right-hand side.","- Maximum 3-hour stay
- Children under 4 years are admitted free",,Experience luxury and relaxation at its best as you step into the Kolkata Travel Club Lounge. Begin your journey with comfort and convenience in this sophisticated sanctuary.,5,Travel Club Lounge,,Terminal2,International Departures,FALSE,,,1,5,5,5,5,https://cinsim.sgp1.digitaloceanspaces.com/airports/1691665136133033316916651361330333mapImg.webp,https://cinsim.sgp1.digitaloceanspaces.com/lounges/1695194330616887216951943306168872LoungeImages_des1.webp,https://cinsim.sgp1.digitaloceanspaces.com/lounges/1695194330854366616951943308543666LoungeImages_des3.webp,https://cinsim.sgp1.digitaloceanspaces.com/lounges/1695194330752688716951943307526887LoungeImages_des2.webp,115,Amenities,1,components_lounge_amenities_amenities,115,117,TRUE,TRUE,TRUE,,TRUE,FALSE,TRUE,TRUE,TRUE,TRUE,FALSE,FALSE,FALSE,FALSE
24,Kolkata,Netaji Subhas Chandra Bose International Airport,CCU,Kolkata Travel Club lounge domestic,5024,07:00 - 22:00 daily,"To find the lounge, go to Domestic Departures at the Mezzanine Level. After Security Checks, while still inside the Security Area, turn left where the lounge is located.","- Children under 4 years are admitted free with an adult.
- This lounge is accessible for passengers traveling on domestic flights only.",,"Welcome to Kolkata Travel Club Lounge Domestic, your gateway to relaxation and comfort. Enjoy superior amenities, relax in a peaceful environment, and receive warm hospitality on your domestic journey.",5,Travel club lounge,,DomesticTerminal,Domestic Departures,TRUE,,,4,2,5,3.75,15,https://cinsim.sgp1.digitaloceanspaces.com/airports/1691665136133033316916651361330333mapImg.webp,https://cinsim.sgp1.digitaloceanspaces.com/lounges/1691574362459156016915743624591560LoungeImages_des1.webp,https://cinsim.sgp1.digitaloceanspaces.com/lounges/1691574174850345116915741748503451LoungeImages_des2.webp,https://cinsim.sgp1.digitaloceanspaces.com/lounges/1691574174970657716915741749706577LoungeImages_des3.webp,58,Amenities,1,components_lounge_amenities_amenities,58,24,TRUE,TRUE,FALSE,,TRUE,FALSE,TRUE,TRUE,TRUE,TRUE,FALSE,FALSE,FALSE,FALSE
26,Kolkata,Netaji Subhas Chandra Bose International Airport,CCU,Kolkata Travel Club lounge International,5026,24 hours,"To reach the lounge, go to the Airside on International Departures. It's located across from Gate 10 after you pass through Security Checks.","- Separate smoking room available outside the lounge.
- Children under 4 years old are admitted free with an adult.",,"Welcome to Kolkata Travel Club Lounge International, where you will find comfort and luxury. Enjoy premium facilities, relax in comfort, and enjoy first-class service to make your international trip really unforgettable.",5,Travel club lounge,,InternationalTerminal,International departures,TRUE,,,1,5,5,5,5,https://cinsim.sgp1.digitaloceanspaces.com/airports/1691665136133033316916651361330333mapImg.webp,https://cinsim.sgp1.digitaloceanspaces.com/lounges/1691574057052065516915740570520655LoungeImages_des1.webp,https://cinsim.sgp1.digitaloceanspaces.com/lounges/1691574057301674516915740573016745LoungeImages_des3.webp,https://cinsim.sgp1.digitaloceanspaces.com/lounges/1691574057199582816915740571995828LoungeImages_des2.webp,22,Amenities,1,components_lounge_amenities_amenities,22,26,TRUE,TRUE,TRUE,,TRUE,FALSE,TRUE,TRUE,TRUE,TRUE,FALSE,FALSE,FALSE,FALSE
43,Kozhikode,Calicut International Airport,CCJ,Calicut Bird Lounge International T2,5043,24 Hours,"Airside - International Departures, Inside the Security Hold Area. The Lounge is Located on Level 1, Near Gate 1.   ","- Children under 5 years old are admitted free with an adult.
- This lounge is accessible for passengers departing on international flights only.",,Step into Calicut International Airport's Domestic Bird Lounge at Terminal 2! Relax and enjoy the cozy space before your domestic flight. Treat yourself to delicious snacks and excellent service.,20,Bird Lounge,,Terminal2,"International Departures, Terminal 2",TRUE,,,4,1,5,3,12,https://cinsim.sgp1.digitaloceanspaces.com/airports/1731326940661347117313269406613471mapImg.jpeg,https://cinsim.sgp1.digitaloceanspaces.com/lounges/1691582358702997916915823587029979LoungeImages_des1.webp,https://cinsim.sgp1.digitaloceanspaces.com/lounges/1691582358828684016915823588286840LoungeImages_des2.webp,https://cinsim.sgp1.digitaloceanspaces.com/lounges/1691582358860582216915823588605822LoungeImages_des3.webp,38,Amenities,1,components_lounge_amenities_amenities,38,43,TRUE,TRUE,TRUE,,FALSE,TRUE,TRUE,TRUE,TRUE,TRUE,FALSE,FALSE,FALSE,FALSE
131,Lucknow,Chaudhary Charan Singh International Airport,LKO,Lucknow Airport,,24 hours,"  Located at Domestic Departure near boarding gates

",,,,6,Adani Lounge,,Terminal3,Lucknow Airport,FALSE,,,1,1,3,1,1,https://cinsim.sgp1.digitaloceanspaces.com/airports/1691665664591049416916656645910494mapImg.webp,https://cinsim.sgp1.digitaloceanspaces.com/lounges/1728466801546201017284668015462010LoungeImages_des1.webp,https://cinsim.sgp1.digitaloceanspaces.com/lounges/1728466801735758317284668017357583LoungeImages_des2.webp,https://cinsim.sgp1.digitaloceanspaces.com/lounges/1728466801834613317284668018346133LoungeImages_des3.webp,129,Amenities,1,components_lounge_amenities_amenities,129,131,TRUE,FALSE,TRUE,,TRUE,FALSE,FALSE,TRUE,TRUE,TRUE,TRUE,FALSE,FALSE,FALSE
44,Lucknow,Chaudhary Charan Singh International Airport,LKO,Lucknow the lounge domestic,5044,06:00 - 23:00 daily,"To find the way, head to Domestic Departures on the 1st Floor, after passing through Security Checks. Look for the lounge next to Costa Coffee and Boarding Gate 5.",- This lounge is only accessible for passengers departing on domestic flights.,,"Welcome to ""The Lounge"" Domestic in Lucknow, where luxury meets convenience. Relax in comfort, enjoy delicious amenities, and enjoy warm hospitality for an amazing pre-flight experience.",6,The lounge,,Terminal2,Domestic Terminal,TRUE,,,5,1,5,3,15,https://cinsim.sgp1.digitaloceanspaces.com/airports/1691665664591049416916656645910494mapImg.webp,https://cinsim.sgp1.digitaloceanspaces.com/lounges/1691574941821463816915749418214638LoungeImages_des1.webp,https://cinsim.sgp1.digitaloceanspaces.com/lounges/1691574941845898816915749418458988LoungeImages_des2.webp,https://cinsim.sgp1.digitaloceanspaces.com/lounges/1691574941980720916915749419807209LoungeImages_des3.webp,39,Amenities,1,components_lounge_amenities_amenities,39,44,TRUE,TRUE,TRUE,,TRUE,FALSE,TRUE,TRUE,TRUE,TRUE,FALSE,FALSE,FALSE,FALSE
119,Madurai,Madurai International Airport,IXM,Madurai Cram Bar lounge domestic,,05:00 - 23:00,"You can find this lounge on the first floor, right by Gate 5 in the Domestic Departures area after you've passed through security.
","- Children under 12 are admitted free with an adult.
- Maximum 2-hour stay.",,"Step into the Madurai Cram Bar Lounge at the domestic terminal for a cozy and classy pre-flight experience. Enjoy a calm atmosphere, tasty treats, and chill vibes before your domestic journey. It's not just a lounge—it's the perfect start to a trip filled with comfort and ease.",30,Cram Bar,,DomesticTerminal,Domestic Terminal,FALSE,,,2,1,4,1,2,https://cinsim.sgp1.digitaloceanspaces.com/airports/1691665119315496716916651193154967mapImg.webp,https://cinsim.sgp1.digitaloceanspaces.com/lounges/1698661425421371616986614254213716LoungeImages_des1.webp,https://cinsim.sgp1.digitaloceanspaces.com/lounges/1698661425564596616986614255645966LoungeImages_des2.webp,https://cinsim.sgp1.digitaloceanspaces.com/lounges/1698661425681615316986614256816153LoungeImages_des3.webp,117,Amenities,1,components_lounge_amenities_amenities,117,119,TRUE,TRUE,TRUE,,TRUE,FALSE,TRUE,TRUE,TRUE,TRUE,FALSE,FALSE,FALSE,FALSE
45,Madurai,Madurai International Airport,IXM,Madurai Primus lounge international,5045,24 hours,"Airside - After Security Hold Area, 1st Floor, near the escalator.","- Maximum 3 hour stay
- Children under 12 years are admitted free
- Separate smoking room available outside the lounge.",,"Madhurai Airport's Primus International Lounge is an oasis of comfort and convenience for travelers. With a sleek and modern design, the lounge offers a range of amenities, including complimentary snacks and beverages, Wi-Fi access, and comfortable seating options.",30,Primus lounge,,InternationalTerminal,International Terminal (After Security Check),TRUE,,,1,5,5,5,5,https://cinsim.sgp1.digitaloceanspaces.com/airports/1691665119315496716916651193154967mapImg.webp,https://cinsim.sgp1.digitaloceanspaces.com/lounges/1711607016473591117116070164735911LoungeImages_des1.webp,https://cinsim.sgp1.digitaloceanspaces.com/lounges/1711607016481137517116070164811375LoungeImages_des2.webp,https://cinsim.sgp1.digitaloceanspaces.com/lounges/1711607016489280817116070164892808LoungeImages_des3.webp,40,Amenities,1,components_lounge_amenities_amenities,40,45,TRUE,TRUE,TRUE,,TRUE,FALSE,TRUE,TRUE,TRUE,TRUE,FALSE,FALSE,FALSE,FALSE
46,Madurai,Madurai International Airport,IXM,Madurai Primus lounge Domestic,5046,24 hours,"To reach your destination, go to the 1st floor on the airside, near the escalator, after the Security Hold Area.","- Children under 12 are admitted free with an adult.
- Complimentary use of iPad.
- Maximum 3-hour stay.",,"Welcome to Madurai Primus Lounge, a haven of luxury and relaxation. Enjoy superior amenities, excellent service, and a peaceful ambiance, which creates a great place to relax before your domestic travel.",30,Primus lounge,,Terminal1,Domestic Departures,TRUE,,,2,3,5,4,8,https://cinsim.sgp1.digitaloceanspaces.com/airports/1691665119315496716916651193154967mapImg.webp,https://cinsim.sgp1.digitaloceanspaces.com/lounges/1691578653576185616915786535761856LoungeImages_des1.webp,https://cinsim.sgp1.digitaloceanspaces.com/lounges/1691578653708451516915786537084515LoungeImages_des2.webp,,41,Amenities,1,components_lounge_amenities_amenities,41,46,TRUE,TRUE,TRUE,,TRUE,FALSE,TRUE,TRUE,TRUE,TRUE,FALSE,FALSE,FALSE,FALSE
122,Mopa,Manohar International Airport,GOX,Goa Mopa Encalm Lounge International,,24 hours,Go to the Airside in the International Departures area. It's located opposite to 'KFC' and next to Duty Free.,"- Maximum 2 hour stay.
- Children under 8 years are admitted free.
- Separate smoking area available.",,"Welcome to the Goa Mopa Encalm International Lounge - a place to relax during your travels. Enjoy top-notch comfort, incredible amenities, and kind hospitality that will make your trip unforgettable.",96,Encalm Lounge,,InternationalTerminal,Airside - International Departures,TRUE,"Encalm Lounge: Your Gateway to Relaxation at GOX Terminal 1
","Escape the hustle and bustle at Encalm Lounge in GOX Terminal 1. Indulge in premium amenities and unwind in style before your flight.
",2,1,5,1,2,https://cinsim.sgp1.digitaloceanspaces.com/airports/1731312096089750517313120960897505mapImg.jpeg,https://cinsim.sgp1.digitaloceanspaces.com/lounges/1708432892626111317084328926261113LoungeImages_des1.webp,https://cinsim.sgp1.digitaloceanspaces.com/lounges/1708432893070248217084328930702482LoungeImages_des2.webp,https://cinsim.sgp1.digitaloceanspaces.com/lounges/1708432893577254717084328935772547LoungeImages_des3.webp,120,Amenities,1,components_lounge_amenities_amenities,120,122,FALSE,TRUE,TRUE,,FALSE,TRUE,TRUE,TRUE,TRUE,TRUE,FALSE,FALSE,FALSE,FALSE
103,Mopa,Manohar International Airport,GOX,Goa Mopa Encalm Lounge Domestic,,24 Hours,"Go to the Airside in the Domestic Departures area. It's located next to the Relay Store.

",,,"Welcome to Goa Mopa Encalm Lounge, a relaxing stop on your travel. Enjoy supreme comfort, amazing amenities, and kind hospitality to make your trip experience absolutely unforgettable.",96,Encalm Lounge,,DomesticTerminal,Airside - Domestic Departures,TRUE,"Encalm Lounge: Your Haven of Comfort at GOX Terminal 1
","Discover tranquility and luxury at Encalm Lounge in GOX Terminal 1. Relax in style with premium amenities and personalized service before your flight.
",4,5,5,5,20,https://cinsim.sgp1.digitaloceanspaces.com/airports/1731312096089750517313120960897505mapImg.jpeg,https://cinsim.sgp1.digitaloceanspaces.com/lounges/1691583317493176716915833174931767LoungeImages_des1.webp,https://cinsim.sgp1.digitaloceanspaces.com/lounges/1691583317651319016915833176513190LoungeImages_des3.webp,https://cinsim.sgp1.digitaloceanspaces.com/lounges/1691583317619061416915833176190614LoungeImages_des2.webp,102,Amenities,1,components_lounge_amenities_amenities,102,103,TRUE,TRUE,TRUE,,TRUE,FALSE,TRUE,TRUE,TRUE,TRUE,TRUE,FALSE,FALSE,FALSE
60,Mumbai,Chhatrapati Shivaji International Airport,BOM,Mumbai Loyalty lounge clipper international t2,5060,24 hours,"This Lounge is Located at the International Departures area, airside. After Security Checks, turn right and walk through the Lotus House. Take the lift in Pranaam Lounge to the 3rd Floor. ","- Shower facilities (45 minutes) available for INR 1000 plus taxes and levies.
- Cabanas (3 hours) available for INR 3000 plus taxes and levies.
-  Children under 2 years old are admitted free with an adult.",,"Welcome to Mumbai Oasis Lounge Dom T1, before your flight, you can relax and unwind. This paradise, located in Domestic Terminal 1, provides excellent service for a comfortable journey.",2,Loyalty Lounge,,Terminal2,International Terminal,TRUE,,,2,4,5,4.5,9,https://cinsim.sgp1.digitaloceanspaces.com/airports/1691665722559902616916657225599026mapImg.webp,https://cinsim.sgp1.digitaloceanspaces.com/lounges/1691568769540524116915687695405241LoungeImages_des1.webp,https://cinsim.sgp1.digitaloceanspaces.com/lounges/1691568769713229616915687697132296LoungeImages_des3.webp,https://cinsim.sgp1.digitaloceanspaces.com/lounges/1691573716981186916915737169811869LoungeImages_des2.webp,57,Amenities,1,components_lounge_amenities_amenities,57,60,TRUE,TRUE,FALSE,,TRUE,FALSE,TRUE,TRUE,TRUE,TRUE,TRUE,FALSE,FALSE,FALSE
20,Mumbai,Chhatrapati Shivaji International Airport,BOM,Mumbai Travel club lounge domestic t2,5020,24 hours,"This Lounge is located after the security check, in the airside area. You'll spot it right across from Gate 44. Enjoy a comfortable and relaxing time before your domestic flights.","- Children under 4 years are admitted free.
- This lounge is only accessible for passengers on domestic flights from Terminal 2.",,"Experience comfort at its best in Mumbai's Travel Club Lounge, Domestic T2, with top-notch facilities before your domestic journey.",2,Travel club lounge,,Terminal2,"Domestic Departure, Terminal 2",TRUE,,,1,5,5,5,5,https://cinsim.sgp1.digitaloceanspaces.com/airports/1691665722559902616916657225599026mapImg.webp,https://cinsim.sgp1.digitaloceanspaces.com/lounges/1691568853030713816915688530307138LoungeImages_des1.webp,https://cinsim.sgp1.digitaloceanspaces.com/lounges/1691568853156355416915688531563554LoungeImages_des2.webp,https://cinsim.sgp1.digitaloceanspaces.com/lounges/1691573922544872416915739225448724LoungeImages_des3.webp,17,Amenities,1,components_lounge_amenities_amenities,17,20,TRUE,TRUE,TRUE,,TRUE,FALSE,TRUE,TRUE,TRUE,TRUE,FALSE,FALSE,FALSE,FALSE
18,Mumbai,Chhatrapati Shivaji International Airport,BOM,Mumbai Oasis lounge dom t1,5018,03:00 - 23:00 daily,"This Lounge is located in the Domestic Departures area, airside. Pass through Security Hold Area and take the lift near Security Check counter No.9 to the next floor.","- For Priority Pass and Lounge Club cardmembers, access is only permitted up to 3 hours before scheduled flight departure.
- Lounge access pricing varies from INR 600 for breakfast, high tea, and midnight hours to INR 800 for lunch and dinner hours.",,"Welcome to Mumbai Oasis Lounge Dom T1! Before your flight, you can relax and unwind. This paradise, located in Domestic Terminal 1, provides excellent service for a comfortable journey.",2,Oasis lounge,,Terminal1,Domestic Departures,TRUE,,,7,1,5,3.142857143,22,https://cinsim.sgp1.digitaloceanspaces.com/airports/1691665722559902616916657225599026mapImg.webp,https://cinsim.sgp1.digitaloceanspaces.com/lounges/1691568922152224816915689221522248LoungeImages_des1.webp,https://cinsim.sgp1.digitaloceanspaces.com/lounges/1691568922445590016915689224455900LoungeImages_des3.webp,https://cinsim.sgp1.digitaloceanspaces.com/lounges/1691568922296568416915689222965684LoungeImages_des2.webp,15,Amenities,1,components_lounge_amenities_amenities,15,18,TRUE,TRUE,TRUE,,TRUE,FALSE,TRUE,TRUE,FALSE,TRUE,FALSE,FALSE,FALSE,FALSE
59,Mumbai,Chhatrapati Shivaji International Airport,BOM,Mumbai Adani lounge terminal 2 international,5059,24 hours,"This Lounge is Located just After Immigration, on Level 4,  located near Gates 85 & 86. Enjoy a relaxing and premium experience during your travel journey.",,,Step into a world of comfort and luxury at Mumbai's Adani Lounge in Terminal 2 International. Enjoy top-notch amenities and excellent service for an unforgettable travel experience,2,Adani Lounge (International West Wing),,Terminal2,"International Departures, terminal 2",TRUE,,,1,5,5,5,5,https://cinsim.sgp1.digitaloceanspaces.com/airports/1691665722559902616916657225599026mapImg.webp,https://cinsim.sgp1.digitaloceanspaces.com/lounges/1691568810444518616915688104445186LoungeImages_des1.webp,https://cinsim.sgp1.digitaloceanspaces.com/lounges/1691568810776534216915688107765342LoungeImages_des3.webp,https://cinsim.sgp1.digitaloceanspaces.com/lounges/1691568810629192016915688106291920LoungeImages_des2.webp,56,Amenities,1,components_lounge_amenities_amenities,56,59,TRUE,TRUE,FALSE,,TRUE,FALSE,TRUE,TRUE,TRUE,TRUE,TRUE,FALSE,FALSE,FALSE
85,Mumbai,Chhatrapati Shivaji International Airport,BOM,Mumbai Aviserv lounge Arrival,5082,24 hours,"You can find the lounge in Mumbai's Terminal 2 (Outside Security). Go to Level 2 (Arrivals Level), pass Customs and Baggage Claim, then turn left. The lounge is right next to Gate A. ","- Children under 6 years old are admitted free with an adult.
- Printing service charged at INR 20 + 18% GST per copy.",,Discover the Mumbai Aviserv Lounge Arrival at the airport! Relax and recharge after your trip. Enjoy excellent amenities and get ready for your next adventure!,2,Aviserv lounge,,Terminal2,"Terminal 2, Arrival Lounge",TRUE,,,1,5,5,5,5,https://cinsim.sgp1.digitaloceanspaces.com/airports/1691665722559902616916657225599026mapImg.webp,https://cinsim.sgp1.digitaloceanspaces.com/lounges/1691568738399649116915687383996491LoungeImages_des1.webp,https://cinsim.sgp1.digitaloceanspaces.com/lounges/1691568738680424416915687386804244LoungeImages_des3.webp,https://cinsim.sgp1.digitaloceanspaces.com/lounges/1691568738530115416915687385301154LoungeImages_des2.webp,83,Amenities,1,components_lounge_amenities_amenities,83,85,TRUE,TRUE,FALSE,,TRUE,FALSE,TRUE,TRUE,FALSE,TRUE,FALSE,FALSE,FALSE,FALSE
19,Mumbai,Chhatrapati Shivaji International Airport,BOM,Mumbai Travel club lounge domestic T1C,5019,24 hours,"You'll find the Mumbai Travel Club Lounge at the Domestic Departures area, airside. Head to the 3rd Floor, right across from Gate 44, and enjoy a comfortable and relaxing experience before your flight.","- Children under 4 years are admitted free with an adult.
- This lounge is accessible for passengers on domestic flights from Terminal 1C.",,"Welcome to the Mumbai Travel Club Lounge, Domestic T1C! Relax and recharge in comfort before your domestic flight. Located conveniently for an enjoyable travel experience.",2,Travel club lounge,,Terminal1,"Domestic Departures, Terminal 1B",TRUE,,,5,3,5,3.8,19,https://cinsim.sgp1.digitaloceanspaces.com/airports/1691665722559902616916657225599026mapImg.webp,https://cinsim.sgp1.digitaloceanspaces.com/lounges/1691568883207900016915688832079000LoungeImages_des1.webp,https://cinsim.sgp1.digitaloceanspaces.com/lounges/1691568883355508816915688833555088LoungeImages_des2.webp,https://cinsim.sgp1.digitaloceanspaces.com/lounges/1691568883491869716915688834918697LoungeImages_des3.webp,16,Amenities,1,components_lounge_amenities_amenities,16,19,TRUE,TRUE,TRUE,,TRUE,FALSE,TRUE,TRUE,TRUE,TRUE,FALSE,FALSE,FALSE,FALSE
87,Mumbai,Chhatrapati Shivaji International Airport,BOM,Mumbai Adani lounge terminal 2,5084,24 hours,"This lounge is located inside the security area. You'll find it on Level 3, at the Domestic Pier, right across from Gates 44 and 45. Enjoy the comforts and amenities as you wait for your domestic flight.",,,Welcome to Mumbai's Adani Lounge in Terminal 2! Get a comfortable and peaceful time before your flight. Enjoy top-notch amenities and start your journey in style!,2,Adani lounge,,Terminal2,Domestic Terminal,TRUE,,,4,1,5,2,8,https://cinsim.sgp1.digitaloceanspaces.com/airports/1691665722559902616916657225599026mapImg.webp,https://cinsim.sgp1.digitaloceanspaces.com/lounges/1691568706742219716915687067422197LoungeImages_des1.webp,https://cinsim.sgp1.digitaloceanspaces.com/lounges/1691568707005661216915687070056612LoungeImages_des3.webp,https://cinsim.sgp1.digitaloceanspaces.com/lounges/1691568706889184216915687068891842LoungeImages_des2.webp,85,Amenities,1,components_lounge_amenities_amenities,85,87,TRUE,FALSE,FALSE,,TRUE,FALSE,TRUE,TRUE,TRUE,TRUE,FALSE,FALSE,FALSE,FALSE
15,Mumbai,Chhatrapati Shivaji International Airport,BOM,Mumbai The Centurion lounge domestic t3,5015,24 hours,"The Lounge is Located on Level 3, just across from Burger King in the Domestic Departure Area. Relax and enjoy premium services before your domestic flight.","- Children under 12 can enter free with an adult.
- Alcohol is complimentary for Centurion cardholders, but not for Platinum cardholders.",,Welcome to Mumbai's The Centurion Lounge in Domestic Terminal 3! Enjoy luxury and relaxation with top-notch amenities before your domestic flight.,2,The Centurion Lounge,,Terminal2,"Domestic Departure, Terminal 2",TRUE,,,4,3,5,3.75,15,https://cinsim.sgp1.digitaloceanspaces.com/airports/1691665722559902616916657225599026mapImg.webp,https://cinsim.sgp1.digitaloceanspaces.com/lounges/1691568952905299316915689529052993LoungeImages_des1.webp,https://cinsim.sgp1.digitaloceanspaces.com/lounges/1691568953028959516915689530289595LoungeImages_des2.webp,https://cinsim.sgp1.digitaloceanspaces.com/lounges/1691568953141237816915689531412378LoungeImages_des3.webp,12,Amenities,1,components_lounge_amenities_amenities,12,15,FALSE,FALSE,TRUE,,TRUE,FALSE,TRUE,FALSE,TRUE,FALSE,FALSE,FALSE,FALSE,FALSE
123,Nagpur,Dr. Babasaheb Ambedkar International Airport,NAG,Nagpur The Airr Lounge Domestic,,06:00 - 23:00,"Go to the Airside in the Domestic Departures area. The lounge is located on the 1st Floor, near the baby care room.","- Maximum 2 hour stay.
- Children under 5 years are admitted free.",,"With comfortable seating, delicious food and beverages, and a range of amenities to enjoy, this airport lounge is the ideal spot to escape the hustle and bustle of the airport. Whether you're traveling for business or pleasure, The Airr Lounge has everything you need to start your journey off right.",26,The Airr Lounge,,DomesticTerminal,Domestic Departure,TRUE,,,3,1,5,3,9,https://cinsim.sgp1.digitaloceanspaces.com/airports/1691665750929211216916657509292112mapImg.webp,https://cinsim.sgp1.digitaloceanspaces.com/lounges/1709789426984438317097894269844383LoungeImages_des1.webp,https://cinsim.sgp1.digitaloceanspaces.com/lounges/1709789427152807917097894271528079LoungeImages_des3.webp,https://cinsim.sgp1.digitaloceanspaces.com/lounges/1709789427009913417097894270099134LoungeImages_des2.webp,121,Amenities,1,components_lounge_amenities_amenities,121,123,TRUE,FALSE,TRUE,,TRUE,FALSE,TRUE,TRUE,TRUE,TRUE,FALSE,FALSE,FALSE,FALSE
47,Nagpur,Dr. Babasaheb Ambedkar International Airport,NAG,Nagpur Mandarin lounge domestic,5047,09:00 -23:00 daily,"To find the domestic departure area before security checks, go to the 1st floor on the landside.

","- Complimentary luggage storage is available.
- Shoe shine is available inside the lounge.",,"Enter the luxury of Nagpur Mandarin Lounge Domestic. As you wait for your domestic flight, relax in comfort, enjoy delicious food, and unwind in style.",26,Mandarin lounge,,DomesticTerminal,Domestic Terminal,TRUE,,,1,5,5,5,5,https://cinsim.sgp1.digitaloceanspaces.com/airports/1691665750929211216916657509292112mapImg.webp,https://cinsim.sgp1.digitaloceanspaces.com/lounges/1691577792975648016915777929756480LoungeImages_des1.webp,https://cinsim.sgp1.digitaloceanspaces.com/lounges/1691577793203042216915777932030422LoungeImages_des3.webp,https://cinsim.sgp1.digitaloceanspaces.com/lounges/1691577793101839416915777931018394LoungeImages_des2.webp,42,Amenities,1,components_lounge_amenities_amenities,42,47,TRUE,TRUE,TRUE,,TRUE,FALSE,TRUE,TRUE,TRUE,TRUE,FALSE,FALSE,FALSE,FALSE
